{
    "version" : "0.1",
    "id" : "touchpad-controller",
    "handedness" : {
        "none" : {
            "asset" : "some-url",
            "root" : "none-controller-node",
            "components" : [0],
            "selectionComponent" : 0
        },
        "left" : {
            "asset" : "some-url",
            "root" : "none-controller-node",
            "components" : [0],
            "selectionComponent" : 0
        },
        "right" : {
            "asset" : "some-url",
            "root" : "none-controller-node",
            "components" : [0],
            "selectionComponent" : 0
        }
    },
    "components" : [
        {
            "dataSource" : 0,
            "root" : "touchpad-node",
            "labelTransform" : "touchpad-label-transform",
            "touchpadDot" : "touchpad-dot",
            "visualResponses" : [0, 1, 2, 3]
        }
    ],
    "dataSources" : [
        {
            "id" : "touchpad",
            "dataSourceType": "touchpadSource",
            "xAxisIndex" : 0,
            "yAxisIndex" : 1,
            "buttonIndex" : 2
        }
    ],
    "visualResponses" : [
        {
            "rootNodeName": "TOUCHPAD_PRESS",
            "source" : "state",
            "states" : ["pressed"]
        },
        {
            "rootNodeName": "TOUCH",
            "source" : "state",
            "states" : ["touched", "pressed"],
            "property": "visibility"
        },
        {
            "rootNodeName": "TOUCHPAD_TOUCH_X",
            "source" : "xAxis",
            "states" : ["default", "touched", "pressed"]
        },
        {
            "rootNodeName": "TOUCHPAD_TOUCH_Y",
            "source" : "yAxis",
            "states" : ["default", "touched", "pressed"]
        }
    ]
}