{
    "version" : "0.1",
    "id" : "button-controller",
    "handedness" : {
        "none" : {
            "asset" : "some-url",
            "root" : "none-controller-node",
            "components" : [0],
            "selectionComponent": 0
        },
        "left" : {
            "asset" : "some-url",
            "root" : "none-controller-node",
            "components" : [0],
            "selectionComponent": 0
        },
        "right" : {
            "asset" : "some-url",
            "root" : "none-controller-node",
            "components" : [0],
            "selectionComponent": 0
        }
    },
    "components" : [
        {
            "dataSource" : 0,
            "root" : "button-node",
            "labelTransform" : "button-label-transform",
            "visualResponses" : [0]
        }
    ],
    "dataSources" : [
        {
            "id" : "button",
            "dataSourceType": "buttonSource",
            "buttonIndex" : 0
        }
    ],
    "visualResponses" : [
        {
            "rootNodeName" : "SELECT",
            "source" : "buttonValue",
            "states" : ["default", "touched", "pressed"]
        }
    ]
}