{
    "version" : "0.1",
    "id" : "WebVR OpenVR Gamepad",
    "webVR": true,
    "handedness" : {
        "none" : {
            "asset" : "some-url",
            "root" : "none-controller-node",
            "webVR_targetRayOrigin": "none-controller-pointing-origin",
            "components" : [0, 1, 2],
            "selectionComponent" : 0
        },
        "left" : {
            "asset" : "some-url",
            "root" : "none-controller-node",
            "webVR_targetRayOrigin": "none-controller-pointing-origin",
            "components" : [0, 1, 2],
            "selectionComponent" : 0
        },
        "right" : {
            "asset" : "some-url",
            "root" : "none-controller-node",
            "webVR_targetRayOrigin": "none-controller-pointing-origin",
            "components" : [0, 1, 2],
            "selectionComponent" : 0
        }
    },
    "components" : [
        {
            "dataSource" : 0,
            "root" : "trackpad-node",
            "labelTransform" : "trackpad-label-transform",
            "visualResponses": [0, 1, 2, 3, 4, 5],
            "touchpadDot" : "touchpad-dot"
        },
        {
            "dataSource" : 1,
            "root" : "trigger-node",
            "labelTransform" : "trigger-label-transform",
            "visualResponses": [6]
        },
        {
            "dataSource" : 2,
            "root" : "faceButton-node",
            "labelTransform" : "faceButton-label-transform",
            "visualResponses": [7]
        }
    ],
    "dataSources" : [
        {
            "id" : "trackpad",
            "dataSourceType": "touchpadSource",
            "xAxisIndex" : 0,
            "yAxisIndex" : 1,
            "buttonIndex" : 0
        },
        {
            "id" : "trigger",
            "dataSourceType": "buttonSource",
            "buttonIndex" : 1,
            "analogValues" : true
        },
        {
            "id" : "grip",
            "dataSourceType": "buttonSource",
            "buttonIndex" : 2
        }
    ],
    "visualResponses" : [
        {
            "rootNodeName": "TOUCHPAD_PRESS",
            "source" : "state",
            "states" : ["pressed"]
        },
        {
            "rootNodeName": "TOUCHPAD_PRESS_X",
            "source" : "xAxis",
            "states" : ["pressed"]
        },
        {
            "rootNodeName": "TOUCHPAD_PRESS_Y",
            "source" : "yAxis",
            "states" : ["pressed"]
        },
        {
            "rootNodeName": "TOUCHPAD_TOUCH",
            "source" : "state",
            "states" : ["touched", "pressed"]
        },
        {
            "rootNodeName": "TOUCHPAD_TOUCH_X",
            "source" : "xAxis",
            "states" : ["touched", "pressed"]
        },
        {
            "rootNodeName": "TOUCHPAD_TOUCH_Y",
            "source" : "yAxis",
            "states" : ["touched", "pressed"]
        },
        {
            "rootNodeName" : "TRIGGER",
            "source" : "buttonValue",
            "states" : ["default", "touched", "pressed"]
        },
        {
            "rootNodeName" : "FACE_BUTTON",
            "source" : "buttonValue",
            "states" : ["default", "touched", "pressed"]
        }
    ]
}