{
    "version" : "0.1",
    "id" : "thumbstick-controller",
    "handedness" : {
        "none" : {
            "asset" : "some-url",
            "root" : "none-controller-node",
            "components" : [0],
            "selectionComponent" : 0
        },
        "left" : {
            "asset" : "some-url",
            "root" : "none-controller-node",
            "components" : [0],
            "selectionComponent" : 0
        },
        "right" : {
            "asset" : "some-url",
            "root" : "none-controller-node",
            "components" : [0],
            "selectionComponent" : 0
        }
    },
    "components" : [
        {
            "dataSource" : 0,
            "root" : "thumbstick-node",
            "labelTransform" : "thumbstick-label-transform",
            "visualResponses" : [0, 1, 2]
        }
    ],
    "dataSources" : [
        {
            "id" : "thumbstick",
            "dataSourceType": "thumbstickSource",
            "xAxisIndex" : 2,
            "yAxisIndex" : 3,
            "buttonIndex" : 3
        }
    ],
    "visualResponses" : [
        {
            "rootNodeName": "THUMBSTICK_PRESS",
            "source" : "state",
            "states" : ["pressed"]
        },
        {
            "rootNodeName": "THUMBSTICK_X",
            "source" : "xAxis",
            "states" : ["default", "touched", "pressed"]
        },
        {
            "rootNodeName": "THUMBSTICK_Y",
            "source" : "yAxis",
            "states" : ["default", "touched", "pressed"]
        }
    ]
}