{
    "version" : "0.1",
    "id" : "google-daydream",
    "handedness" : {
        "none" : {
            "asset" : "some-url",
            "root" : "none-controller-node",
            "components" : [0],
            "selectionComponent" : 0
        }
    },
    "components" : [
        {
            "dataSource" : 0,
            "root" : "thumbpad-node",
            "labelTransform" : "thumbpad-label-transform",
            "visualResponses" : [0, 1, 2, 3, 4]
        }
    ],
    "dataSources" : [
        {
            "id" : "thumbpad",
            "dataSourceType": "touchpadSource",
            "xAxisIndex" : 0,
            "yAxisIndex" : 1,
            "buttonIndex" : 0
        }
    ],
    "visualResponses" : [
        {
            "rootNodeName": "TOUCHPAD_TOUCH_DOT_X",
            "source": "xAxis",
            "states": ["default", "touched", "pressed"]
        },
        {
            "rootNodeName": "TOUCHPAD_TOUCH_DOT_Y",
            "source": "yAxis",
            "states": ["default", "touched", "pressed"]
        },
        {
            "rootNodeName": "TOUCHPAD_TOUCH_DOT",
            "source": "state",
            "states": ["touched", "pressed"],
            "property": "visibility"
        },
        {
            "rootNodeName": "TOUCHPAD_PRESS_X",
            "source": "xAxis",
            "states": ["pressed"]
        },
        {
            "rootNodeName": "TOUCHPAD_PRESS_Y",
            "source": "yAxis",
            "states": ["pressed"]
        }
    ]
}